{
	"final_summary" : "SavepointManager.java: SavepointManager does not have any design pattern.  It is a public interface. The 3 methods of SavepointManager are createSavepoint (Object), rollbackToSavepoint (void) and releaseSavepoint (void). No methods call createSavepoint and createSavepoint calls no methods. No methods call rollbackToSavepoint and rollbackToSavepoint calls no methods. No methods call releaseSavepoint and releaseSavepoint calls no methods.\n\n\nTransactionTemplate.java: TransactionTemplate does not have any design pattern.  It is a public class that extends DefaultTransactionDefinition and that implements TransactionOperations and InitializingBean. The 6 methods of TransactionTemplate are setTransactionManager (void), getTransactionManager (PlatformTransactionManager), afterPropertiesSet (void), execute (T), rollbackOnException (void) and equals (boolean). No methods call setTransactionManager and setTransactionManager calls no methods. Only one method ( equals method of class TransactionTemplate ) calls getTransactionManager and getTransactionManager calls no methods. No methods call afterPropertiesSet and afterPropertiesSet calls no methods. No methods call execute and execute calls no methods. No methods call rollbackOnException and rollbackOnException calls no methods. No methods call equals and equals calls only one method : getTransactionManager method of class TransactionTemplate.\n\n\nAbstractTransactionStatus.java: AbstractTransactionStatus does not have any design pattern.  It is a public abstract class that implements TransactionStatus. The 16 methods of AbstractTransactionStatus are setRollbackOnly (void), isRollbackOnly (boolean), isLocalRollbackOnly (boolean), isGlobalRollbackOnly (boolean), setCompleted (void), isCompleted (boolean), hasSavepoint (boolean), setSavepoint (void), getSavepoint (Object), createAndHoldSavepoint (void), rollbackToHeldSavepoint (void), releaseHeldSavepoint (void), createSavepoint (Object), rollbackToSavepoint (void), releaseSavepoint (void) and getSavepointManager (SavepointManager). No methods call setRollbackOnly and setRollbackOnly calls no methods. No methods call isRollbackOnly and isRollbackOnly calls 2 methods : isGlobalRollbackOnly method of class AbstractTransactionStatus and isLocalRollbackOnly method of class AbstractTransactionStatus. Only one method ( isRollbackOnly method of class AbstractTransactionStatus ) calls isLocalRollbackOnly and isLocalRollbackOnly calls no methods. Only one method ( isRollbackOnly method of class AbstractTransactionStatus ) calls isGlobalRollbackOnly and isGlobalRollbackOnly calls no methods. No methods call setCompleted and setCompleted calls no methods. No methods call isCompleted and isCompleted calls no methods. No methods call hasSavepoint and hasSavepoint calls no methods. 3 methods ( rollbackToHeldSavepoint method of class AbstractTransactionStatus, createAndHoldSavepoint method of class AbstractTransactionStatus and releaseHeldSavepoint method of class AbstractTransactionStatus ) call setSavepoint and setSavepoint calls no methods. 2 methods ( rollbackToHeldSavepoint method of class AbstractTransactionStatus and releaseHeldSavepoint method of class AbstractTransactionStatus ) call getSavepoint and getSavepoint calls no methods. No methods call createAndHoldSavepoint and createAndHoldSavepoint calls 2 methods : setSavepoint method of class AbstractTransactionStatus and getSavepointManager method of class AbstractTransactionStatus. No methods call rollbackToHeldSavepoint and rollbackToHeldSavepoint calls 3 methods : getSavepoint method of class AbstractTransactionStatus, setSavepoint method of class AbstractTransactionStatus and getSavepointManager method of class AbstractTransactionStatus. No methods call releaseHeldSavepoint and releaseHeldSavepoint calls 3 methods : getSavepoint method of class AbstractTransactionStatus, setSavepoint method of class AbstractTransactionStatus and getSavepointManager method of class AbstractTransactionStatus. No methods call createSavepoint and createSavepoint calls only one method : getSavepointManager method of class AbstractTransactionStatus. No methods call rollbackToSavepoint and rollbackToSavepoint calls only one method : getSavepointManager method of class AbstractTransactionStatus. No methods call releaseSavepoint and releaseSavepoint calls only one method : getSavepointManager method of class AbstractTransactionStatus. 6 methods ( releaseSavepoint method of class AbstractTransactionStatus, rollbackToHeldSavepoint method of class AbstractTransactionStatus, createAndHoldSavepoint method of class AbstractTransactionStatus, rollbackToSavepoint method of class AbstractTransactionStatus, createSavepoint method of class AbstractTransactionStatus and releaseHeldSavepoint method of class AbstractTransactionStatus ) call getSavepointManager and getSavepointManager calls no methods.\n\n\n",
	"design_pattern" : [ ],
	"spring-tx" : {
		"SavepointManager" : {
			"FIELDDETAIL" : [ ],
			"CLASSORINTERFACEDETAIL" : [ {
				"CLASSACCESSSPECIFIER" : "PUBLIC",
				"NUMBEROFMETHODCALLS" : 0,
				"EXTENDSFROM" : [ ],
				"IMPLEMENTSFROM" : [ ],
				"CLASSNAME" : "SavepointManager",
				"ISINTERFACEORNOT" : true,
				"CLASSTYPEPARAMS" : [ ],
				"ISABSTRACTORNOT" : false,
				"CLASSMODIFIERTYPE" : [ "public" ]
			} ],
			"CONSTRUCTORDETAIL" : [ ],
			"VARIABLEDETAIL" : [ ],
			"METHODDETAIL" : [ {
				"METHODNAME" : "createSavepoint",
				"NUMBEROFINCOMINGMETHODS" : 0,
				"INCOMINGMETHOD" : [ ],
				"METHODMODIFIERTYPE" : [ ],
				"METHODBODYLINETYPE" : [ ],
				"NUMBEROFMETHODVARIABLES" : 0,
				"NUMBEROFOUTGOINGMETHODS" : 0,
				"METHODRETURNTYPE" : "Object",
				"METHODOVERRIDE" : [ ],
				"OUTGOINGMETHOD" : [ ],
				"NUMBEROFMETHODLINES" : 0,
				"METHODPARAMETER" : [ ]
			}, {
				"METHODNAME" : "rollbackToSavepoint",
				"NUMBEROFINCOMINGMETHODS" : 0,
				"INCOMINGMETHOD" : [ ],
				"METHODMODIFIERTYPE" : [ ],
				"METHODBODYLINETYPE" : [ ],
				"NUMBEROFMETHODVARIABLES" : 0,
				"NUMBEROFOUTGOINGMETHODS" : 0,
				"METHODRETURNTYPE" : "void",
				"METHODOVERRIDE" : [ ],
				"OUTGOINGMETHOD" : [ ],
				"NUMBEROFMETHODLINES" : 0,
				"METHODPARAMETER" : [ {
					"PARAMETERNAME" : "savepoint",
					"PARAMETERTYPE" : "Object"
				} ]
			}, {
				"METHODNAME" : "releaseSavepoint",
				"NUMBEROFINCOMINGMETHODS" : 0,
				"INCOMINGMETHOD" : [ ],
				"METHODMODIFIERTYPE" : [ ],
				"METHODBODYLINETYPE" : [ ],
				"NUMBEROFMETHODVARIABLES" : 0,
				"NUMBEROFOUTGOINGMETHODS" : 0,
				"METHODRETURNTYPE" : "void",
				"METHODOVERRIDE" : [ ],
				"OUTGOINGMETHOD" : [ ],
				"NUMBEROFMETHODLINES" : 0,
				"METHODPARAMETER" : [ {
					"PARAMETERNAME" : "savepoint",
					"PARAMETERTYPE" : "Object"
				} ]
			} ]
		},
		"TransactionTemplate" : {
			"FIELDDETAIL" : [ {
				"FIELDCOMMONTYPE" : "Log",
				"FIELDMODIFIERTYPE" : [ "protected", "final" ],
				"FIELDDECLARATION" : [ "logger = LogFactory.getLog(getClass())" ],
				"FIELDDATATYPE" : "Log",
				"FIELDACCESSSPECIFIER" : "PROTECTED"
			}, {
				"FIELDCOMMONTYPE" : "PlatformTransactionManager",
				"FIELDMODIFIERTYPE" : [ "private" ],
				"FIELDDECLARATION" : [ "transactionManager" ],
				"FIELDDATATYPE" : "PlatformTransactionManager",
				"FIELDACCESSSPECIFIER" : "PRIVATE"
			} ],
			"CLASSORINTERFACEDETAIL" : [ {
				"CLASSACCESSSPECIFIER" : "PUBLIC",
				"NUMBEROFMETHODCALLS" : 18,
				"EXTENDSFROM" : [ "DefaultTransactionDefinition" ],
				"IMPLEMENTSFROM" : [ "TransactionOperations", "InitializingBean" ],
				"CLASSNAME" : "TransactionTemplate",
				"ISINTERFACEORNOT" : false,
				"CLASSTYPEPARAMS" : [ ],
				"ISABSTRACTORNOT" : false,
				"CLASSMODIFIERTYPE" : [ "public" ]
			} ],
			"CONSTRUCTORDETAIL" : [ {
				"CONSTRUCTORMODIFIER" : [ "public" ],
				"CONSTRUCTORPARAMETER" : [ ]
			}, {
				"CONSTRUCTORMODIFIER" : [ "public" ],
				"CONSTRUCTORPARAMETER" : [ {
					"PARAMETERNAME" : "transactionManager",
					"PARAMETERTYPE" : "PlatformTransactionManager"
				} ]
			}, {
				"CONSTRUCTORMODIFIER" : [ "public" ],
				"CONSTRUCTORPARAMETER" : [ {
					"PARAMETERNAME" : "transactionManager",
					"PARAMETERTYPE" : "PlatformTransactionManager"
				}, {
					"PARAMETERNAME" : "transactionDefinition",
					"PARAMETERTYPE" : "TransactionDefinition"
				} ]
			} ],
			"VARIABLEDETAIL" : [ {
				"VARIABLEDECLARATION" : [ "status = this.transactionManager.getTransaction(this)" ],
				"VARIABLECOMMONTYPE" : "TransactionStatus",
				"VARIABLEELEMENTTYPE" : "TransactionStatus"
			}, {
				"VARIABLEDECLARATION" : [ "result" ],
				"VARIABLECOMMONTYPE" : "T",
				"VARIABLEELEMENTTYPE" : "T"
			} ],
			"METHODDETAIL" : [ {
				"METHODNAME" : "setTransactionManager",
				"NUMBEROFINCOMINGMETHODS" : 0,
				"INCOMINGMETHOD" : [ ],
				"METHODMODIFIERTYPE" : [ "public" ],
				"METHODBODYLINETYPE" : [ "EXPRESSION" ],
				"NUMBEROFMETHODVARIABLES" : 0,
				"NUMBEROFOUTGOINGMETHODS" : 0,
				"METHODRETURNTYPE" : "void",
				"METHODOVERRIDE" : [ ],
				"OUTGOINGMETHOD" : [ ],
				"NUMBEROFMETHODLINES" : 1,
				"METHODPARAMETER" : [ {
					"PARAMETERNAME" : "PlatformTransactionManager",
					"PARAMETERTYPE" : "@Nullable"
				} ]
			}, {
				"METHODNAME" : "getTransactionManager",
				"NUMBEROFINCOMINGMETHODS" : 2,
				"INCOMINGMETHOD" : [ {
					"CALLEDMETHODNAME" : "equals",
					"CALLEDCLASS" : "TransactionTemplate"
				}, {
					"CALLEDMETHODNAME" : "equals",
					"CALLEDCLASS" : "TransactionTemplate"
				} ],
				"METHODMODIFIERTYPE" : [ "public" ],
				"METHODBODYLINETYPE" : [ "RETURN" ],
				"NUMBEROFMETHODVARIABLES" : 0,
				"NUMBEROFOUTGOINGMETHODS" : 0,
				"METHODRETURNTYPE" : "PlatformTransactionManager",
				"METHODOVERRIDE" : [ "@Nullable" ],
				"OUTGOINGMETHOD" : [ ],
				"NUMBEROFMETHODLINES" : 1,
				"METHODPARAMETER" : [ ]
			}, {
				"METHODNAME" : "afterPropertiesSet",
				"NUMBEROFINCOMINGMETHODS" : 0,
				"INCOMINGMETHOD" : [ ],
				"METHODMODIFIERTYPE" : [ "public" ],
				"METHODBODYLINETYPE" : [ "IF" ],
				"NUMBEROFMETHODVARIABLES" : 0,
				"NUMBEROFOUTGOINGMETHODS" : 0,
				"METHODRETURNTYPE" : "void",
				"METHODOVERRIDE" : [ "@Override" ],
				"OUTGOINGMETHOD" : [ ],
				"NUMBEROFMETHODLINES" : 1,
				"METHODPARAMETER" : [ ]
			}, {
				"METHODNAME" : "execute",
				"NUMBEROFINCOMINGMETHODS" : 0,
				"INCOMINGMETHOD" : [ ],
				"METHODMODIFIERTYPE" : [ "public" ],
				"METHODBODYLINETYPE" : [ "EXPRESSION", "IF" ],
				"NUMBEROFMETHODVARIABLES" : 0,
				"NUMBEROFOUTGOINGMETHODS" : 7,
				"METHODRETURNTYPE" : "T",
				"METHODOVERRIDE" : [ "@Override" ],
				"OUTGOINGMETHOD" : [ ],
				"NUMBEROFMETHODLINES" : 2,
				"METHODPARAMETER" : [ {
					"PARAMETERNAME" : "action",
					"PARAMETERTYPE" : "TransactionCallback<T>"
				} ]
			}, {
				"METHODNAME" : "rollbackOnException",
				"NUMBEROFINCOMINGMETHODS" : 0,
				"INCOMINGMETHOD" : [ ],
				"METHODMODIFIERTYPE" : [ "private" ],
				"METHODBODYLINETYPE" : [ "EXPRESSION", "EXPRESSION", "OTHER" ],
				"NUMBEROFMETHODVARIABLES" : 0,
				"NUMBEROFOUTGOINGMETHODS" : 6,
				"METHODRETURNTYPE" : "void",
				"METHODOVERRIDE" : [ ],
				"OUTGOINGMETHOD" : [ ],
				"NUMBEROFMETHODLINES" : 3,
				"METHODPARAMETER" : [ {
					"PARAMETERNAME" : "status",
					"PARAMETERTYPE" : "TransactionStatus"
				}, {
					"PARAMETERNAME" : "ex",
					"PARAMETERTYPE" : "Throwable"
				} ]
			}, {
				"METHODNAME" : "equals",
				"NUMBEROFINCOMINGMETHODS" : 0,
				"INCOMINGMETHOD" : [ ],
				"METHODMODIFIERTYPE" : [ "public" ],
				"METHODBODYLINETYPE" : [ "RETURN" ],
				"NUMBEROFMETHODVARIABLES" : 0,
				"NUMBEROFOUTGOINGMETHODS" : 3,
				"METHODRETURNTYPE" : "boolean",
				"METHODOVERRIDE" : [ "@Override" ],
				"OUTGOINGMETHOD" : [ {
					"CALLEECLASS" : "TransactionTemplate",
					"CALLEEMETHODNAME" : "getTransactionManager"
				}, {
					"CALLEECLASS" : "TransactionTemplate",
					"CALLEEMETHODNAME" : "getTransactionManager"
				} ],
				"NUMBEROFMETHODLINES" : 1,
				"METHODPARAMETER" : [ {
					"PARAMETERNAME" : "Object",
					"PARAMETERTYPE" : "@Nullable"
				} ]
			} ]
		},
		"AbstractTransactionStatus" : {
			"FIELDDETAIL" : [ {
				"FIELDCOMMONTYPE" : "boolean",
				"FIELDMODIFIERTYPE" : [ "private" ],
				"FIELDDECLARATION" : [ "rollbackOnly = false" ],
				"FIELDDATATYPE" : "boolean",
				"FIELDACCESSSPECIFIER" : "PRIVATE"
			}, {
				"FIELDCOMMONTYPE" : "boolean",
				"FIELDMODIFIERTYPE" : [ "private" ],
				"FIELDDECLARATION" : [ "completed = false" ],
				"FIELDDATATYPE" : "boolean",
				"FIELDACCESSSPECIFIER" : "PRIVATE"
			}, {
				"FIELDCOMMONTYPE" : "Object",
				"FIELDMODIFIERTYPE" : [ "private" ],
				"FIELDDECLARATION" : [ "savepoint" ],
				"FIELDDATATYPE" : "Object",
				"FIELDACCESSSPECIFIER" : "PRIVATE"
			} ],
			"CLASSORINTERFACEDETAIL" : [ {
				"CLASSACCESSSPECIFIER" : "PUBLIC",
				"NUMBEROFMETHODCALLS" : 25,
				"EXTENDSFROM" : [ ],
				"IMPLEMENTSFROM" : [ "TransactionStatus" ],
				"CLASSNAME" : "AbstractTransactionStatus",
				"ISINTERFACEORNOT" : false,
				"CLASSTYPEPARAMS" : [ ],
				"ISABSTRACTORNOT" : true,
				"CLASSMODIFIERTYPE" : [ "public", "abstract" ]
			} ],
			"CONSTRUCTORDETAIL" : [ ],
			"VARIABLEDETAIL" : [ {
				"VARIABLEDECLARATION" : [ "savepoint = getSavepointManager().createSavepoint()" ],
				"VARIABLECOMMONTYPE" : "Object",
				"VARIABLEELEMENTTYPE" : "Object"
			}, {
				"VARIABLEDECLARATION" : [ "savepoint = getSavepoint()" ],
				"VARIABLECOMMONTYPE" : "Object",
				"VARIABLEELEMENTTYPE" : "Object"
			}, {
				"VARIABLEDECLARATION" : [ "savepoint = getSavepoint()" ],
				"VARIABLECOMMONTYPE" : "Object",
				"VARIABLEELEMENTTYPE" : "Object"
			}, {
				"VARIABLEDECLARATION" : [ "savepoint = getSavepointManager().createSavepoint()" ],
				"VARIABLECOMMONTYPE" : "Object",
				"VARIABLEELEMENTTYPE" : "Object"
			} ],
			"METHODDETAIL" : [ {
				"METHODNAME" : "setRollbackOnly",
				"NUMBEROFINCOMINGMETHODS" : 0,
				"INCOMINGMETHOD" : [ ],
				"METHODMODIFIERTYPE" : [ "public" ],
				"METHODBODYLINETYPE" : [ "IF", "EXPRESSION" ],
				"NUMBEROFMETHODVARIABLES" : 0,
				"NUMBEROFOUTGOINGMETHODS" : 0,
				"METHODRETURNTYPE" : "void",
				"METHODOVERRIDE" : [ "@Override" ],
				"OUTGOINGMETHOD" : [ ],
				"NUMBEROFMETHODLINES" : 2,
				"METHODPARAMETER" : [ ]
			}, {
				"METHODNAME" : "isRollbackOnly",
				"NUMBEROFINCOMINGMETHODS" : 0,
				"INCOMINGMETHOD" : [ ],
				"METHODMODIFIERTYPE" : [ "public" ],
				"METHODBODYLINETYPE" : [ "RETURN" ],
				"NUMBEROFMETHODVARIABLES" : 0,
				"NUMBEROFOUTGOINGMETHODS" : 2,
				"METHODRETURNTYPE" : "boolean",
				"METHODOVERRIDE" : [ "@Override" ],
				"OUTGOINGMETHOD" : [ {
					"CALLEECLASS" : "AbstractTransactionStatus",
					"CALLEEMETHODNAME" : "isLocalRollbackOnly"
				}, {
					"CALLEECLASS" : "AbstractTransactionStatus",
					"CALLEEMETHODNAME" : "isGlobalRollbackOnly"
				} ],
				"NUMBEROFMETHODLINES" : 1,
				"METHODPARAMETER" : [ ]
			}, {
				"METHODNAME" : "isLocalRollbackOnly",
				"NUMBEROFINCOMINGMETHODS" : 1,
				"INCOMINGMETHOD" : [ {
					"CALLEDMETHODNAME" : "isRollbackOnly",
					"CALLEDCLASS" : "AbstractTransactionStatus"
				} ],
				"METHODMODIFIERTYPE" : [ "public" ],
				"METHODBODYLINETYPE" : [ "RETURN" ],
				"NUMBEROFMETHODVARIABLES" : 0,
				"NUMBEROFOUTGOINGMETHODS" : 0,
				"METHODRETURNTYPE" : "boolean",
				"METHODOVERRIDE" : [ ],
				"OUTGOINGMETHOD" : [ ],
				"NUMBEROFMETHODLINES" : 1,
				"METHODPARAMETER" : [ ]
			}, {
				"METHODNAME" : "isGlobalRollbackOnly",
				"NUMBEROFINCOMINGMETHODS" : 1,
				"INCOMINGMETHOD" : [ {
					"CALLEDMETHODNAME" : "isRollbackOnly",
					"CALLEDCLASS" : "AbstractTransactionStatus"
				} ],
				"METHODMODIFIERTYPE" : [ "public" ],
				"METHODBODYLINETYPE" : [ "RETURN" ],
				"NUMBEROFMETHODVARIABLES" : 0,
				"NUMBEROFOUTGOINGMETHODS" : 0,
				"METHODRETURNTYPE" : "boolean",
				"METHODOVERRIDE" : [ ],
				"OUTGOINGMETHOD" : [ ],
				"NUMBEROFMETHODLINES" : 1,
				"METHODPARAMETER" : [ ]
			}, {
				"METHODNAME" : "setCompleted",
				"NUMBEROFINCOMINGMETHODS" : 0,
				"INCOMINGMETHOD" : [ ],
				"METHODMODIFIERTYPE" : [ "public" ],
				"METHODBODYLINETYPE" : [ "EXPRESSION" ],
				"NUMBEROFMETHODVARIABLES" : 0,
				"NUMBEROFOUTGOINGMETHODS" : 0,
				"METHODRETURNTYPE" : "void",
				"METHODOVERRIDE" : [ ],
				"OUTGOINGMETHOD" : [ ],
				"NUMBEROFMETHODLINES" : 1,
				"METHODPARAMETER" : [ ]
			}, {
				"METHODNAME" : "isCompleted",
				"NUMBEROFINCOMINGMETHODS" : 0,
				"INCOMINGMETHOD" : [ ],
				"METHODMODIFIERTYPE" : [ "public" ],
				"METHODBODYLINETYPE" : [ "RETURN" ],
				"NUMBEROFMETHODVARIABLES" : 0,
				"NUMBEROFOUTGOINGMETHODS" : 0,
				"METHODRETURNTYPE" : "boolean",
				"METHODOVERRIDE" : [ "@Override" ],
				"OUTGOINGMETHOD" : [ ],
				"NUMBEROFMETHODLINES" : 1,
				"METHODPARAMETER" : [ ]
			}, {
				"METHODNAME" : "hasSavepoint",
				"NUMBEROFINCOMINGMETHODS" : 0,
				"INCOMINGMETHOD" : [ ],
				"METHODMODIFIERTYPE" : [ "public" ],
				"METHODBODYLINETYPE" : [ "RETURN" ],
				"NUMBEROFMETHODVARIABLES" : 0,
				"NUMBEROFOUTGOINGMETHODS" : 0,
				"METHODRETURNTYPE" : "boolean",
				"METHODOVERRIDE" : [ "@Override" ],
				"OUTGOINGMETHOD" : [ ],
				"NUMBEROFMETHODLINES" : 1,
				"METHODPARAMETER" : [ ]
			}, {
				"METHODNAME" : "setSavepoint",
				"NUMBEROFINCOMINGMETHODS" : 3,
				"INCOMINGMETHOD" : [ {
					"CALLEDMETHODNAME" : "createAndHoldSavepoint",
					"CALLEDCLASS" : "AbstractTransactionStatus"
				}, {
					"CALLEDMETHODNAME" : "releaseHeldSavepoint",
					"CALLEDCLASS" : "AbstractTransactionStatus"
				}, {
					"CALLEDMETHODNAME" : "rollbackToHeldSavepoint",
					"CALLEDCLASS" : "AbstractTransactionStatus"
				} ],
				"METHODMODIFIERTYPE" : [ "protected" ],
				"METHODBODYLINETYPE" : [ "EXPRESSION" ],
				"NUMBEROFMETHODVARIABLES" : 0,
				"NUMBEROFOUTGOINGMETHODS" : 0,
				"METHODRETURNTYPE" : "void",
				"METHODOVERRIDE" : [ ],
				"OUTGOINGMETHOD" : [ ],
				"NUMBEROFMETHODLINES" : 1,
				"METHODPARAMETER" : [ {
					"PARAMETERNAME" : "Object",
					"PARAMETERTYPE" : "@Nullable"
				} ]
			}, {
				"METHODNAME" : "getSavepoint",
				"NUMBEROFINCOMINGMETHODS" : 2,
				"INCOMINGMETHOD" : [ {
					"CALLEDMETHODNAME" : "releaseHeldSavepoint",
					"CALLEDCLASS" : "AbstractTransactionStatus"
				}, {
					"CALLEDMETHODNAME" : "rollbackToHeldSavepoint",
					"CALLEDCLASS" : "AbstractTransactionStatus"
				} ],
				"METHODMODIFIERTYPE" : [ "protected" ],
				"METHODBODYLINETYPE" : [ "RETURN" ],
				"NUMBEROFMETHODVARIABLES" : 0,
				"NUMBEROFOUTGOINGMETHODS" : 0,
				"METHODRETURNTYPE" : "Object",
				"METHODOVERRIDE" : [ "@Nullable" ],
				"OUTGOINGMETHOD" : [ ],
				"NUMBEROFMETHODLINES" : 1,
				"METHODPARAMETER" : [ ]
			}, {
				"METHODNAME" : "createAndHoldSavepoint",
				"NUMBEROFINCOMINGMETHODS" : 0,
				"INCOMINGMETHOD" : [ ],
				"METHODMODIFIERTYPE" : [ "public" ],
				"METHODBODYLINETYPE" : [ "EXPRESSION", "EXPRESSION", "EXPRESSION" ],
				"NUMBEROFMETHODVARIABLES" : 1,
				"NUMBEROFOUTGOINGMETHODS" : 4,
				"METHODRETURNTYPE" : "void",
				"METHODOVERRIDE" : [ ],
				"OUTGOINGMETHOD" : [ {
					"CALLEECLASS" : "AbstractTransactionStatus",
					"CALLEEMETHODNAME" : "getSavepointManager"
				}, {
					"CALLEECLASS" : "AbstractTransactionStatus",
					"CALLEEMETHODNAME" : "setSavepoint"
				} ],
				"NUMBEROFMETHODLINES" : 3,
				"METHODPARAMETER" : [ ]
			}, {
				"METHODNAME" : "rollbackToHeldSavepoint",
				"NUMBEROFINCOMINGMETHODS" : 0,
				"INCOMINGMETHOD" : [ ],
				"METHODMODIFIERTYPE" : [ "public" ],
				"METHODBODYLINETYPE" : [ "EXPRESSION", "IF", "EXPRESSION", "EXPRESSION", "EXPRESSION", "EXPRESSION" ],
				"NUMBEROFMETHODVARIABLES" : 1,
				"NUMBEROFOUTGOINGMETHODS" : 7,
				"METHODRETURNTYPE" : "void",
				"METHODOVERRIDE" : [ ],
				"OUTGOINGMETHOD" : [ {
					"CALLEECLASS" : "AbstractTransactionStatus",
					"CALLEEMETHODNAME" : "getSavepoint"
				}, {
					"CALLEECLASS" : "AbstractTransactionStatus",
					"CALLEEMETHODNAME" : "getSavepointManager"
				}, {
					"CALLEECLASS" : "AbstractTransactionStatus",
					"CALLEEMETHODNAME" : "getSavepointManager"
				}, {
					"CALLEECLASS" : "AbstractTransactionStatus",
					"CALLEEMETHODNAME" : "setSavepoint"
				} ],
				"NUMBEROFMETHODLINES" : 6,
				"METHODPARAMETER" : [ ]
			}, {
				"METHODNAME" : "releaseHeldSavepoint",
				"NUMBEROFINCOMINGMETHODS" : 0,
				"INCOMINGMETHOD" : [ ],
				"METHODMODIFIERTYPE" : [ "public" ],
				"METHODBODYLINETYPE" : [ "EXPRESSION", "IF", "EXPRESSION", "EXPRESSION" ],
				"NUMBEROFMETHODVARIABLES" : 1,
				"NUMBEROFOUTGOINGMETHODS" : 4,
				"METHODRETURNTYPE" : "void",
				"METHODOVERRIDE" : [ ],
				"OUTGOINGMETHOD" : [ {
					"CALLEECLASS" : "AbstractTransactionStatus",
					"CALLEEMETHODNAME" : "getSavepoint"
				}, {
					"CALLEECLASS" : "AbstractTransactionStatus",
					"CALLEEMETHODNAME" : "getSavepointManager"
				}, {
					"CALLEECLASS" : "AbstractTransactionStatus",
					"CALLEEMETHODNAME" : "setSavepoint"
				} ],
				"NUMBEROFMETHODLINES" : 4,
				"METHODPARAMETER" : [ ]
			}, {
				"METHODNAME" : "createSavepoint",
				"NUMBEROFINCOMINGMETHODS" : 0,
				"INCOMINGMETHOD" : [ ],
				"METHODMODIFIERTYPE" : [ "public" ],
				"METHODBODYLINETYPE" : [ "EXPRESSION", "EXPRESSION", "RETURN" ],
				"NUMBEROFMETHODVARIABLES" : 1,
				"NUMBEROFOUTGOINGMETHODS" : 3,
				"METHODRETURNTYPE" : "Object",
				"METHODOVERRIDE" : [ "@Override" ],
				"OUTGOINGMETHOD" : [ {
					"CALLEECLASS" : "AbstractTransactionStatus",
					"CALLEEMETHODNAME" : "getSavepointManager"
				} ],
				"NUMBEROFMETHODLINES" : 3,
				"METHODPARAMETER" : [ ]
			}, {
				"METHODNAME" : "rollbackToSavepoint",
				"NUMBEROFINCOMINGMETHODS" : 0,
				"INCOMINGMETHOD" : [ ],
				"METHODMODIFIERTYPE" : [ "public" ],
				"METHODBODYLINETYPE" : [ "EXPRESSION", "EXPRESSION" ],
				"NUMBEROFMETHODVARIABLES" : 0,
				"NUMBEROFOUTGOINGMETHODS" : 3,
				"METHODRETURNTYPE" : "void",
				"METHODOVERRIDE" : [ "@Override" ],
				"OUTGOINGMETHOD" : [ {
					"CALLEECLASS" : "AbstractTransactionStatus",
					"CALLEEMETHODNAME" : "getSavepointManager"
				} ],
				"NUMBEROFMETHODLINES" : 2,
				"METHODPARAMETER" : [ {
					"PARAMETERNAME" : "savepoint",
					"PARAMETERTYPE" : "Object"
				} ]
			}, {
				"METHODNAME" : "releaseSavepoint",
				"NUMBEROFINCOMINGMETHODS" : 0,
				"INCOMINGMETHOD" : [ ],
				"METHODMODIFIERTYPE" : [ "public" ],
				"METHODBODYLINETYPE" : [ "EXPRESSION" ],
				"NUMBEROFMETHODVARIABLES" : 0,
				"NUMBEROFOUTGOINGMETHODS" : 2,
				"METHODRETURNTYPE" : "void",
				"METHODOVERRIDE" : [ "@Override" ],
				"OUTGOINGMETHOD" : [ {
					"CALLEECLASS" : "AbstractTransactionStatus",
					"CALLEEMETHODNAME" : "getSavepointManager"
				} ],
				"NUMBEROFMETHODLINES" : 1,
				"METHODPARAMETER" : [ {
					"PARAMETERNAME" : "savepoint",
					"PARAMETERTYPE" : "Object"
				} ]
			}, {
				"METHODNAME" : "getSavepointManager",
				"NUMBEROFINCOMINGMETHODS" : 7,
				"INCOMINGMETHOD" : [ {
					"CALLEDMETHODNAME" : "releaseSavepoint",
					"CALLEDCLASS" : "AbstractTransactionStatus"
				}, {
					"CALLEDMETHODNAME" : "createSavepoint",
					"CALLEDCLASS" : "AbstractTransactionStatus"
				}, {
					"CALLEDMETHODNAME" : "createAndHoldSavepoint",
					"CALLEDCLASS" : "AbstractTransactionStatus"
				}, {
					"CALLEDMETHODNAME" : "releaseHeldSavepoint",
					"CALLEDCLASS" : "AbstractTransactionStatus"
				}, {
					"CALLEDMETHODNAME" : "rollbackToHeldSavepoint",
					"CALLEDCLASS" : "AbstractTransactionStatus"
				}, {
					"CALLEDMETHODNAME" : "rollbackToHeldSavepoint",
					"CALLEDCLASS" : "AbstractTransactionStatus"
				}, {
					"CALLEDMETHODNAME" : "rollbackToSavepoint",
					"CALLEDCLASS" : "AbstractTransactionStatus"
				} ],
				"METHODMODIFIERTYPE" : [ "protected" ],
				"METHODBODYLINETYPE" : [ "OTHER" ],
				"NUMBEROFMETHODVARIABLES" : 0,
				"NUMBEROFOUTGOINGMETHODS" : 0,
				"METHODRETURNTYPE" : "SavepointManager",
				"METHODOVERRIDE" : [ ],
				"OUTGOINGMETHOD" : [ ],
				"NUMBEROFMETHODLINES" : 1,
				"METHODPARAMETER" : [ ]
			} ]
		}
	},
	"summary_NLG" : { }
}