{
	"final_summary" : "ClientHttpRequestFactory.java: ClientHttpRequestFactory does not have any design pattern.  It is a public interface. The only method of ClientHttpRequestFactory is createRequest (ClientHttpRequest). No methods call createRequest and createRequest calls no methods.\n\n\nAutowireCapableBeanFactory.java: AutowireCapableBeanFactory does not have any design pattern.  It is a public interface that extends BeanFactory. The 15 methods of AutowireCapableBeanFactory are createBean (T), autowireBean (void), configureBean (Object), createBean (Object), autowire (Object), autowireBeanProperties (void), applyBeanPropertyValues (void), initializeBean (Object), applyBeanPostProcessorsBeforeInitialization (Object), applyBeanPostProcessorsAfterInitialization (Object), destroyBean (void), resolveNamedBean (NamedBeanHolder<T>), resolveBeanByName (Object), resolveDependency (Object) and resolveDependency (Object). No methods call createBean and createBean calls no methods. No methods call autowireBean and autowireBean calls no methods. No methods call configureBean and configureBean calls no methods. No methods call createBean and createBean calls no methods. No methods call autowire and autowire calls no methods. No methods call autowireBeanProperties and autowireBeanProperties calls no methods. No methods call applyBeanPropertyValues and applyBeanPropertyValues calls no methods. No methods call initializeBean and initializeBean calls no methods. No methods call applyBeanPostProcessorsBeforeInitialization and applyBeanPostProcessorsBeforeInitialization calls no methods. No methods call applyBeanPostProcessorsAfterInitialization and applyBeanPostProcessorsAfterInitialization calls no methods. No methods call destroyBean and destroyBean calls no methods. No methods call resolveNamedBean and resolveNamedBean calls no methods. No methods call resolveBeanByName and resolveBeanByName calls no methods. No methods call resolveDependency and resolveDependency calls no methods. No methods call resolveDependency and resolveDependency calls no methods.\n\n\nHierarchicalBeanFactory.java: HierarchicalBeanFactory does not have any design pattern.  It is a public interface that extends BeanFactory. The 2 methods of HierarchicalBeanFactory are getParentBeanFactory (BeanFactory) and containsLocalBean (boolean). No methods call getParentBeanFactory and getParentBeanFactory calls no methods. No methods call containsLocalBean and containsLocalBean calls no methods.\n\n\nListableBeanFactory.java: ListableBeanFactory does not have any design pattern.  It is a public interface that extends BeanFactory. The 16 methods of ListableBeanFactory are containsBeanDefinition (boolean), getBeanDefinitionCount (int), getBeanDefinitionNames (String[]), getBeanProvider (ObjectProvider<T>), getBeanProvider (ObjectProvider<T>), getBeanNamesForType (String[]), getBeanNamesForType (String[]), getBeanNamesForType (String[]), getBeanNamesForType (String[]), getBeansOfType (Map<String,T>), getBeansOfType (Map<String,T>), getBeanNamesForAnnotation (String[]), getBeansWithAnnotation (Map<String,Object>), findAnnotationOnBean (A), findAnnotationOnBean (A) and findAllAnnotationsOnBean (Set<A>). No methods call containsBeanDefinition and containsBeanDefinition calls no methods. No methods call getBeanDefinitionCount and getBeanDefinitionCount calls no methods. No methods call getBeanDefinitionNames and getBeanDefinitionNames calls no methods. No methods call getBeanProvider and getBeanProvider calls no methods. No methods call getBeanProvider and getBeanProvider calls no methods. No methods call getBeanNamesForType and getBeanNamesForType calls no methods. No methods call getBeanNamesForType and getBeanNamesForType calls no methods. No methods call getBeanNamesForType and getBeanNamesForType calls no methods. No methods call getBeanNamesForType and getBeanNamesForType calls no methods. No methods call getBeansOfType and getBeansOfType calls no methods. No methods call getBeansOfType and getBeansOfType calls no methods. No methods call getBeanNamesForAnnotation and getBeanNamesForAnnotation calls no methods. No methods call getBeansWithAnnotation and getBeansWithAnnotation calls no methods. No methods call findAnnotationOnBean and findAnnotationOnBean calls no methods. No methods call findAnnotationOnBean and findAnnotationOnBean calls no methods. No methods call findAllAnnotationsOnBean and findAllAnnotationsOnBean calls no methods.\n\n\n",
	"design_pattern" : [ ],
	"summary_NLG" : { },
	"AbstractFactory" : {
		"ClientHttpRequestFactory" : {
			"FIELDDETAIL" : [ ],
			"CLASSORINTERFACEDETAIL" : [ {
				"CLASSACCESSSPECIFIER" : "PUBLIC",
				"NUMBEROFMETHODCALLS" : 0,
				"EXTENDSFROM" : [ ],
				"IMPLEMENTSFROM" : [ ],
				"CLASSNAME" : "ClientHttpRequestFactory",
				"ISINTERFACEORNOT" : true,
				"CLASSTYPEPARAMS" : [ ],
				"ISABSTRACTORNOT" : false,
				"CLASSMODIFIERTYPE" : [ "public" ]
			} ],
			"CONSTRUCTORDETAIL" : [ ],
			"VARIABLEDETAIL" : [ ],
			"METHODDETAIL" : [ {
				"METHODNAME" : "createRequest",
				"NUMBEROFINCOMINGMETHODS" : 0,
				"INCOMINGMETHOD" : [ ],
				"METHODMODIFIERTYPE" : [ ],
				"METHODBODYLINETYPE" : [ ],
				"NUMBEROFMETHODVARIABLES" : 0,
				"NUMBEROFOUTGOINGMETHODS" : 0,
				"METHODRETURNTYPE" : "ClientHttpRequest",
				"METHODOVERRIDE" : [ ],
				"OUTGOINGMETHOD" : [ ],
				"NUMBEROFMETHODLINES" : 0,
				"METHODPARAMETER" : [ {
					"PARAMETERNAME" : "uri",
					"PARAMETERTYPE" : "URI"
				}, {
					"PARAMETERNAME" : "httpMethod",
					"PARAMETERTYPE" : "HttpMethod"
				} ]
			} ]
		},
		"AutowireCapableBeanFactory" : {
			"FIELDDETAIL" : [ {
				"FIELDCOMMONTYPE" : "int",
				"FIELDMODIFIERTYPE" : [ ],
				"FIELDDECLARATION" : [ "AUTOWIRE_NO = 0" ],
				"FIELDDATATYPE" : "int",
				"FIELDACCESSSPECIFIER" : "NONE"
			}, {
				"FIELDCOMMONTYPE" : "int",
				"FIELDMODIFIERTYPE" : [ ],
				"FIELDDECLARATION" : [ "AUTOWIRE_BY_NAME = 1" ],
				"FIELDDATATYPE" : "int",
				"FIELDACCESSSPECIFIER" : "NONE"
			}, {
				"FIELDCOMMONTYPE" : "int",
				"FIELDMODIFIERTYPE" : [ ],
				"FIELDDECLARATION" : [ "AUTOWIRE_BY_TYPE = 2" ],
				"FIELDDATATYPE" : "int",
				"FIELDACCESSSPECIFIER" : "NONE"
			}, {
				"FIELDCOMMONTYPE" : "int",
				"FIELDMODIFIERTYPE" : [ ],
				"FIELDDECLARATION" : [ "AUTOWIRE_CONSTRUCTOR = 3" ],
				"FIELDDATATYPE" : "int",
				"FIELDACCESSSPECIFIER" : "NONE"
			}, {
				"FIELDCOMMONTYPE" : "int",
				"FIELDMODIFIERTYPE" : [ ],
				"FIELDDECLARATION" : [ "AUTOWIRE_AUTODETECT = 4" ],
				"FIELDDATATYPE" : "int",
				"FIELDACCESSSPECIFIER" : "NONE"
			}, {
				"FIELDCOMMONTYPE" : "String",
				"FIELDMODIFIERTYPE" : [ ],
				"FIELDDECLARATION" : [ "ORIGINAL_INSTANCE_SUFFIX = \".ORIGINAL\"" ],
				"FIELDDATATYPE" : "String",
				"FIELDACCESSSPECIFIER" : "NONE"
			} ],
			"CLASSORINTERFACEDETAIL" : [ {
				"CLASSACCESSSPECIFIER" : "PUBLIC",
				"NUMBEROFMETHODCALLS" : 0,
				"EXTENDSFROM" : [ "BeanFactory" ],
				"IMPLEMENTSFROM" : [ ],
				"CLASSNAME" : "AutowireCapableBeanFactory",
				"ISINTERFACEORNOT" : true,
				"CLASSTYPEPARAMS" : [ ],
				"ISABSTRACTORNOT" : false,
				"CLASSMODIFIERTYPE" : [ "public" ]
			} ],
			"CONSTRUCTORDETAIL" : [ ],
			"VARIABLEDETAIL" : [ ],
			"METHODDETAIL" : [ {
				"METHODNAME" : "createBean",
				"NUMBEROFINCOMINGMETHODS" : 0,
				"INCOMINGMETHOD" : [ ],
				"METHODMODIFIERTYPE" : [ ],
				"METHODBODYLINETYPE" : [ ],
				"NUMBEROFMETHODVARIABLES" : 0,
				"NUMBEROFOUTGOINGMETHODS" : 0,
				"METHODRETURNTYPE" : "T",
				"METHODOVERRIDE" : [ ],
				"OUTGOINGMETHOD" : [ ],
				"NUMBEROFMETHODLINES" : 0,
				"METHODPARAMETER" : [ {
					"PARAMETERNAME" : "beanClass",
					"PARAMETERTYPE" : "Class<T>"
				} ]
			}, {
				"METHODNAME" : "autowireBean",
				"NUMBEROFINCOMINGMETHODS" : 0,
				"INCOMINGMETHOD" : [ ],
				"METHODMODIFIERTYPE" : [ ],
				"METHODBODYLINETYPE" : [ ],
				"NUMBEROFMETHODVARIABLES" : 0,
				"NUMBEROFOUTGOINGMETHODS" : 0,
				"METHODRETURNTYPE" : "void",
				"METHODOVERRIDE" : [ ],
				"OUTGOINGMETHOD" : [ ],
				"NUMBEROFMETHODLINES" : 0,
				"METHODPARAMETER" : [ {
					"PARAMETERNAME" : "existingBean",
					"PARAMETERTYPE" : "Object"
				} ]
			}, {
				"METHODNAME" : "configureBean",
				"NUMBEROFINCOMINGMETHODS" : 0,
				"INCOMINGMETHOD" : [ ],
				"METHODMODIFIERTYPE" : [ ],
				"METHODBODYLINETYPE" : [ ],
				"NUMBEROFMETHODVARIABLES" : 0,
				"NUMBEROFOUTGOINGMETHODS" : 0,
				"METHODRETURNTYPE" : "Object",
				"METHODOVERRIDE" : [ ],
				"OUTGOINGMETHOD" : [ ],
				"NUMBEROFMETHODLINES" : 0,
				"METHODPARAMETER" : [ {
					"PARAMETERNAME" : "existingBean",
					"PARAMETERTYPE" : "Object"
				}, {
					"PARAMETERNAME" : "beanName",
					"PARAMETERTYPE" : "String"
				} ]
			}, {
				"METHODNAME" : "createBean",
				"NUMBEROFINCOMINGMETHODS" : 0,
				"INCOMINGMETHOD" : [ ],
				"METHODMODIFIERTYPE" : [ ],
				"METHODBODYLINETYPE" : [ ],
				"NUMBEROFMETHODVARIABLES" : 0,
				"NUMBEROFOUTGOINGMETHODS" : 0,
				"METHODRETURNTYPE" : "Object",
				"METHODOVERRIDE" : [ "@Deprecated(since = \"6.1\")" ],
				"OUTGOINGMETHOD" : [ ],
				"NUMBEROFMETHODLINES" : 0,
				"METHODPARAMETER" : [ {
					"PARAMETERNAME" : "beanClass",
					"PARAMETERTYPE" : "Class<?>"
				}, {
					"PARAMETERNAME" : "autowireMode",
					"PARAMETERTYPE" : "int"
				}, {
					"PARAMETERNAME" : "dependencyCheck",
					"PARAMETERTYPE" : "boolean"
				} ]
			}, {
				"METHODNAME" : "autowire",
				"NUMBEROFINCOMINGMETHODS" : 0,
				"INCOMINGMETHOD" : [ ],
				"METHODMODIFIERTYPE" : [ ],
				"METHODBODYLINETYPE" : [ ],
				"NUMBEROFMETHODVARIABLES" : 0,
				"NUMBEROFOUTGOINGMETHODS" : 0,
				"METHODRETURNTYPE" : "Object",
				"METHODOVERRIDE" : [ ],
				"OUTGOINGMETHOD" : [ ],
				"NUMBEROFMETHODLINES" : 0,
				"METHODPARAMETER" : [ {
					"PARAMETERNAME" : "beanClass",
					"PARAMETERTYPE" : "Class<?>"
				}, {
					"PARAMETERNAME" : "autowireMode",
					"PARAMETERTYPE" : "int"
				}, {
					"PARAMETERNAME" : "dependencyCheck",
					"PARAMETERTYPE" : "boolean"
				} ]
			}, {
				"METHODNAME" : "autowireBeanProperties",
				"NUMBEROFINCOMINGMETHODS" : 0,
				"INCOMINGMETHOD" : [ ],
				"METHODMODIFIERTYPE" : [ ],
				"METHODBODYLINETYPE" : [ ],
				"NUMBEROFMETHODVARIABLES" : 0,
				"NUMBEROFOUTGOINGMETHODS" : 0,
				"METHODRETURNTYPE" : "void",
				"METHODOVERRIDE" : [ ],
				"OUTGOINGMETHOD" : [ ],
				"NUMBEROFMETHODLINES" : 0,
				"METHODPARAMETER" : [ {
					"PARAMETERNAME" : "existingBean",
					"PARAMETERTYPE" : "Object"
				}, {
					"PARAMETERNAME" : "autowireMode",
					"PARAMETERTYPE" : "int"
				}, {
					"PARAMETERNAME" : "dependencyCheck",
					"PARAMETERTYPE" : "boolean"
				} ]
			}, {
				"METHODNAME" : "applyBeanPropertyValues",
				"NUMBEROFINCOMINGMETHODS" : 0,
				"INCOMINGMETHOD" : [ ],
				"METHODMODIFIERTYPE" : [ ],
				"METHODBODYLINETYPE" : [ ],
				"NUMBEROFMETHODVARIABLES" : 0,
				"NUMBEROFOUTGOINGMETHODS" : 0,
				"METHODRETURNTYPE" : "void",
				"METHODOVERRIDE" : [ ],
				"OUTGOINGMETHOD" : [ ],
				"NUMBEROFMETHODLINES" : 0,
				"METHODPARAMETER" : [ {
					"PARAMETERNAME" : "existingBean",
					"PARAMETERTYPE" : "Object"
				}, {
					"PARAMETERNAME" : "beanName",
					"PARAMETERTYPE" : "String"
				} ]
			}, {
				"METHODNAME" : "initializeBean",
				"NUMBEROFINCOMINGMETHODS" : 0,
				"INCOMINGMETHOD" : [ ],
				"METHODMODIFIERTYPE" : [ ],
				"METHODBODYLINETYPE" : [ ],
				"NUMBEROFMETHODVARIABLES" : 0,
				"NUMBEROFOUTGOINGMETHODS" : 0,
				"METHODRETURNTYPE" : "Object",
				"METHODOVERRIDE" : [ ],
				"OUTGOINGMETHOD" : [ ],
				"NUMBEROFMETHODLINES" : 0,
				"METHODPARAMETER" : [ {
					"PARAMETERNAME" : "existingBean",
					"PARAMETERTYPE" : "Object"
				}, {
					"PARAMETERNAME" : "beanName",
					"PARAMETERTYPE" : "String"
				} ]
			}, {
				"METHODNAME" : "applyBeanPostProcessorsBeforeInitialization",
				"NUMBEROFINCOMINGMETHODS" : 0,
				"INCOMINGMETHOD" : [ ],
				"METHODMODIFIERTYPE" : [ ],
				"METHODBODYLINETYPE" : [ ],
				"NUMBEROFMETHODVARIABLES" : 0,
				"NUMBEROFOUTGOINGMETHODS" : 0,
				"METHODRETURNTYPE" : "Object",
				"METHODOVERRIDE" : [ "@Deprecated(since = \"6.1\")" ],
				"OUTGOINGMETHOD" : [ ],
				"NUMBEROFMETHODLINES" : 0,
				"METHODPARAMETER" : [ {
					"PARAMETERNAME" : "existingBean",
					"PARAMETERTYPE" : "Object"
				}, {
					"PARAMETERNAME" : "beanName",
					"PARAMETERTYPE" : "String"
				} ]
			}, {
				"METHODNAME" : "applyBeanPostProcessorsAfterInitialization",
				"NUMBEROFINCOMINGMETHODS" : 0,
				"INCOMINGMETHOD" : [ ],
				"METHODMODIFIERTYPE" : [ ],
				"METHODBODYLINETYPE" : [ ],
				"NUMBEROFMETHODVARIABLES" : 0,
				"NUMBEROFOUTGOINGMETHODS" : 0,
				"METHODRETURNTYPE" : "Object",
				"METHODOVERRIDE" : [ "@Deprecated(since = \"6.1\")" ],
				"OUTGOINGMETHOD" : [ ],
				"NUMBEROFMETHODLINES" : 0,
				"METHODPARAMETER" : [ {
					"PARAMETERNAME" : "existingBean",
					"PARAMETERTYPE" : "Object"
				}, {
					"PARAMETERNAME" : "beanName",
					"PARAMETERTYPE" : "String"
				} ]
			}, {
				"METHODNAME" : "destroyBean",
				"NUMBEROFINCOMINGMETHODS" : 0,
				"INCOMINGMETHOD" : [ ],
				"METHODMODIFIERTYPE" : [ ],
				"METHODBODYLINETYPE" : [ ],
				"NUMBEROFMETHODVARIABLES" : 0,
				"NUMBEROFOUTGOINGMETHODS" : 0,
				"METHODRETURNTYPE" : "void",
				"METHODOVERRIDE" : [ ],
				"OUTGOINGMETHOD" : [ ],
				"NUMBEROFMETHODLINES" : 0,
				"METHODPARAMETER" : [ {
					"PARAMETERNAME" : "existingBean",
					"PARAMETERTYPE" : "Object"
				} ]
			}, {
				"METHODNAME" : "resolveNamedBean",
				"NUMBEROFINCOMINGMETHODS" : 0,
				"INCOMINGMETHOD" : [ ],
				"METHODMODIFIERTYPE" : [ ],
				"METHODBODYLINETYPE" : [ ],
				"NUMBEROFMETHODVARIABLES" : 0,
				"NUMBEROFOUTGOINGMETHODS" : 0,
				"METHODRETURNTYPE" : "NamedBeanHolder<T>",
				"METHODOVERRIDE" : [ ],
				"OUTGOINGMETHOD" : [ ],
				"NUMBEROFMETHODLINES" : 0,
				"METHODPARAMETER" : [ {
					"PARAMETERNAME" : "requiredType",
					"PARAMETERTYPE" : "Class<T>"
				} ]
			}, {
				"METHODNAME" : "resolveBeanByName",
				"NUMBEROFINCOMINGMETHODS" : 0,
				"INCOMINGMETHOD" : [ ],
				"METHODMODIFIERTYPE" : [ ],
				"METHODBODYLINETYPE" : [ ],
				"NUMBEROFMETHODVARIABLES" : 0,
				"NUMBEROFOUTGOINGMETHODS" : 0,
				"METHODRETURNTYPE" : "Object",
				"METHODOVERRIDE" : [ ],
				"OUTGOINGMETHOD" : [ ],
				"NUMBEROFMETHODLINES" : 0,
				"METHODPARAMETER" : [ {
					"PARAMETERNAME" : "name",
					"PARAMETERTYPE" : "String"
				}, {
					"PARAMETERNAME" : "descriptor",
					"PARAMETERTYPE" : "DependencyDescriptor"
				} ]
			}, {
				"METHODNAME" : "resolveDependency",
				"NUMBEROFINCOMINGMETHODS" : 0,
				"INCOMINGMETHOD" : [ ],
				"METHODMODIFIERTYPE" : [ ],
				"METHODBODYLINETYPE" : [ ],
				"NUMBEROFMETHODVARIABLES" : 0,
				"NUMBEROFOUTGOINGMETHODS" : 0,
				"METHODRETURNTYPE" : "Object",
				"METHODOVERRIDE" : [ "@Nullable" ],
				"OUTGOINGMETHOD" : [ ],
				"NUMBEROFMETHODLINES" : 0,
				"METHODPARAMETER" : [ {
					"PARAMETERNAME" : "descriptor",
					"PARAMETERTYPE" : "DependencyDescriptor"
				}, {
					"PARAMETERNAME" : "String",
					"PARAMETERTYPE" : "@Nullable"
				} ]
			}, {
				"METHODNAME" : "resolveDependency",
				"NUMBEROFINCOMINGMETHODS" : 0,
				"INCOMINGMETHOD" : [ ],
				"METHODMODIFIERTYPE" : [ ],
				"METHODBODYLINETYPE" : [ ],
				"NUMBEROFMETHODVARIABLES" : 0,
				"NUMBEROFOUTGOINGMETHODS" : 0,
				"METHODRETURNTYPE" : "Object",
				"METHODOVERRIDE" : [ "@Nullable" ],
				"OUTGOINGMETHOD" : [ ],
				"NUMBEROFMETHODLINES" : 0,
				"METHODPARAMETER" : [ {
					"PARAMETERNAME" : "descriptor",
					"PARAMETERTYPE" : "DependencyDescriptor"
				}, {
					"PARAMETERNAME" : "String",
					"PARAMETERTYPE" : "@Nullable"
				}, {
					"PARAMETERNAME" : "Set<String>",
					"PARAMETERTYPE" : "@Nullable"
				}, {
					"PARAMETERNAME" : "TypeConverter",
					"PARAMETERTYPE" : "@Nullable"
				} ]
			} ]
		},
		"HierarchicalBeanFactory" : {
			"FIELDDETAIL" : [ ],
			"CLASSORINTERFACEDETAIL" : [ {
				"CLASSACCESSSPECIFIER" : "PUBLIC",
				"NUMBEROFMETHODCALLS" : 0,
				"EXTENDSFROM" : [ "BeanFactory" ],
				"IMPLEMENTSFROM" : [ ],
				"CLASSNAME" : "HierarchicalBeanFactory",
				"ISINTERFACEORNOT" : true,
				"CLASSTYPEPARAMS" : [ ],
				"ISABSTRACTORNOT" : false,
				"CLASSMODIFIERTYPE" : [ "public" ]
			} ],
			"CONSTRUCTORDETAIL" : [ ],
			"VARIABLEDETAIL" : [ ],
			"METHODDETAIL" : [ {
				"METHODNAME" : "getParentBeanFactory",
				"NUMBEROFINCOMINGMETHODS" : 0,
				"INCOMINGMETHOD" : [ ],
				"METHODMODIFIERTYPE" : [ ],
				"METHODBODYLINETYPE" : [ ],
				"NUMBEROFMETHODVARIABLES" : 0,
				"NUMBEROFOUTGOINGMETHODS" : 0,
				"METHODRETURNTYPE" : "BeanFactory",
				"METHODOVERRIDE" : [ "@Nullable" ],
				"OUTGOINGMETHOD" : [ ],
				"NUMBEROFMETHODLINES" : 0,
				"METHODPARAMETER" : [ ]
			}, {
				"METHODNAME" : "containsLocalBean",
				"NUMBEROFINCOMINGMETHODS" : 0,
				"INCOMINGMETHOD" : [ ],
				"METHODMODIFIERTYPE" : [ ],
				"METHODBODYLINETYPE" : [ ],
				"NUMBEROFMETHODVARIABLES" : 0,
				"NUMBEROFOUTGOINGMETHODS" : 0,
				"METHODRETURNTYPE" : "boolean",
				"METHODOVERRIDE" : [ ],
				"OUTGOINGMETHOD" : [ ],
				"NUMBEROFMETHODLINES" : 0,
				"METHODPARAMETER" : [ {
					"PARAMETERNAME" : "name",
					"PARAMETERTYPE" : "String"
				} ]
			} ]
		},
		"ListableBeanFactory" : {
			"FIELDDETAIL" : [ ],
			"CLASSORINTERFACEDETAIL" : [ {
				"CLASSACCESSSPECIFIER" : "PUBLIC",
				"NUMBEROFMETHODCALLS" : 0,
				"EXTENDSFROM" : [ "BeanFactory" ],
				"IMPLEMENTSFROM" : [ ],
				"CLASSNAME" : "ListableBeanFactory",
				"ISINTERFACEORNOT" : true,
				"CLASSTYPEPARAMS" : [ ],
				"ISABSTRACTORNOT" : false,
				"CLASSMODIFIERTYPE" : [ "public" ]
			} ],
			"CONSTRUCTORDETAIL" : [ ],
			"VARIABLEDETAIL" : [ ],
			"METHODDETAIL" : [ {
				"METHODNAME" : "containsBeanDefinition",
				"NUMBEROFINCOMINGMETHODS" : 0,
				"INCOMINGMETHOD" : [ ],
				"METHODMODIFIERTYPE" : [ ],
				"METHODBODYLINETYPE" : [ ],
				"NUMBEROFMETHODVARIABLES" : 0,
				"NUMBEROFOUTGOINGMETHODS" : 0,
				"METHODRETURNTYPE" : "boolean",
				"METHODOVERRIDE" : [ ],
				"OUTGOINGMETHOD" : [ ],
				"NUMBEROFMETHODLINES" : 0,
				"METHODPARAMETER" : [ {
					"PARAMETERNAME" : "beanName",
					"PARAMETERTYPE" : "String"
				} ]
			}, {
				"METHODNAME" : "getBeanDefinitionCount",
				"NUMBEROFINCOMINGMETHODS" : 0,
				"INCOMINGMETHOD" : [ ],
				"METHODMODIFIERTYPE" : [ ],
				"METHODBODYLINETYPE" : [ ],
				"NUMBEROFMETHODVARIABLES" : 0,
				"NUMBEROFOUTGOINGMETHODS" : 0,
				"METHODRETURNTYPE" : "int",
				"METHODOVERRIDE" : [ ],
				"OUTGOINGMETHOD" : [ ],
				"NUMBEROFMETHODLINES" : 0,
				"METHODPARAMETER" : [ ]
			}, {
				"METHODNAME" : "getBeanDefinitionNames",
				"NUMBEROFINCOMINGMETHODS" : 0,
				"INCOMINGMETHOD" : [ ],
				"METHODMODIFIERTYPE" : [ ],
				"METHODBODYLINETYPE" : [ ],
				"NUMBEROFMETHODVARIABLES" : 0,
				"NUMBEROFOUTGOINGMETHODS" : 0,
				"METHODRETURNTYPE" : "String[]",
				"METHODOVERRIDE" : [ ],
				"OUTGOINGMETHOD" : [ ],
				"NUMBEROFMETHODLINES" : 0,
				"METHODPARAMETER" : [ ]
			}, {
				"METHODNAME" : "getBeanProvider",
				"NUMBEROFINCOMINGMETHODS" : 0,
				"INCOMINGMETHOD" : [ ],
				"METHODMODIFIERTYPE" : [ ],
				"METHODBODYLINETYPE" : [ ],
				"NUMBEROFMETHODVARIABLES" : 0,
				"NUMBEROFOUTGOINGMETHODS" : 0,
				"METHODRETURNTYPE" : "ObjectProvider<T>",
				"METHODOVERRIDE" : [ ],
				"OUTGOINGMETHOD" : [ ],
				"NUMBEROFMETHODLINES" : 0,
				"METHODPARAMETER" : [ {
					"PARAMETERNAME" : "requiredType",
					"PARAMETERTYPE" : "Class<T>"
				}, {
					"PARAMETERNAME" : "allowEagerInit",
					"PARAMETERTYPE" : "boolean"
				} ]
			}, {
				"METHODNAME" : "getBeanProvider",
				"NUMBEROFINCOMINGMETHODS" : 0,
				"INCOMINGMETHOD" : [ ],
				"METHODMODIFIERTYPE" : [ ],
				"METHODBODYLINETYPE" : [ ],
				"NUMBEROFMETHODVARIABLES" : 0,
				"NUMBEROFOUTGOINGMETHODS" : 0,
				"METHODRETURNTYPE" : "ObjectProvider<T>",
				"METHODOVERRIDE" : [ ],
				"OUTGOINGMETHOD" : [ ],
				"NUMBEROFMETHODLINES" : 0,
				"METHODPARAMETER" : [ {
					"PARAMETERNAME" : "requiredType",
					"PARAMETERTYPE" : "ResolvableType"
				}, {
					"PARAMETERNAME" : "allowEagerInit",
					"PARAMETERTYPE" : "boolean"
				} ]
			}, {
				"METHODNAME" : "getBeanNamesForType",
				"NUMBEROFINCOMINGMETHODS" : 0,
				"INCOMINGMETHOD" : [ ],
				"METHODMODIFIERTYPE" : [ ],
				"METHODBODYLINETYPE" : [ ],
				"NUMBEROFMETHODVARIABLES" : 0,
				"NUMBEROFOUTGOINGMETHODS" : 0,
				"METHODRETURNTYPE" : "String[]",
				"METHODOVERRIDE" : [ ],
				"OUTGOINGMETHOD" : [ ],
				"NUMBEROFMETHODLINES" : 0,
				"METHODPARAMETER" : [ {
					"PARAMETERNAME" : "type",
					"PARAMETERTYPE" : "ResolvableType"
				} ]
			}, {
				"METHODNAME" : "getBeanNamesForType",
				"NUMBEROFINCOMINGMETHODS" : 0,
				"INCOMINGMETHOD" : [ ],
				"METHODMODIFIERTYPE" : [ ],
				"METHODBODYLINETYPE" : [ ],
				"NUMBEROFMETHODVARIABLES" : 0,
				"NUMBEROFOUTGOINGMETHODS" : 0,
				"METHODRETURNTYPE" : "String[]",
				"METHODOVERRIDE" : [ ],
				"OUTGOINGMETHOD" : [ ],
				"NUMBEROFMETHODLINES" : 0,
				"METHODPARAMETER" : [ {
					"PARAMETERNAME" : "type",
					"PARAMETERTYPE" : "ResolvableType"
				}, {
					"PARAMETERNAME" : "includeNonSingletons",
					"PARAMETERTYPE" : "boolean"
				}, {
					"PARAMETERNAME" : "allowEagerInit",
					"PARAMETERTYPE" : "boolean"
				} ]
			}, {
				"METHODNAME" : "getBeanNamesForType",
				"NUMBEROFINCOMINGMETHODS" : 0,
				"INCOMINGMETHOD" : [ ],
				"METHODMODIFIERTYPE" : [ ],
				"METHODBODYLINETYPE" : [ ],
				"NUMBEROFMETHODVARIABLES" : 0,
				"NUMBEROFOUTGOINGMETHODS" : 0,
				"METHODRETURNTYPE" : "String[]",
				"METHODOVERRIDE" : [ ],
				"OUTGOINGMETHOD" : [ ],
				"NUMBEROFMETHODLINES" : 0,
				"METHODPARAMETER" : [ {
					"PARAMETERNAME" : "Class<?>",
					"PARAMETERTYPE" : "@Nullable"
				} ]
			}, {
				"METHODNAME" : "getBeanNamesForType",
				"NUMBEROFINCOMINGMETHODS" : 0,
				"INCOMINGMETHOD" : [ ],
				"METHODMODIFIERTYPE" : [ ],
				"METHODBODYLINETYPE" : [ ],
				"NUMBEROFMETHODVARIABLES" : 0,
				"NUMBEROFOUTGOINGMETHODS" : 0,
				"METHODRETURNTYPE" : "String[]",
				"METHODOVERRIDE" : [ ],
				"OUTGOINGMETHOD" : [ ],
				"NUMBEROFMETHODLINES" : 0,
				"METHODPARAMETER" : [ {
					"PARAMETERNAME" : "Class<?>",
					"PARAMETERTYPE" : "@Nullable"
				}, {
					"PARAMETERNAME" : "includeNonSingletons",
					"PARAMETERTYPE" : "boolean"
				}, {
					"PARAMETERNAME" : "allowEagerInit",
					"PARAMETERTYPE" : "boolean"
				} ]
			}, {
				"METHODNAME" : "getBeansOfType",
				"NUMBEROFINCOMINGMETHODS" : 0,
				"INCOMINGMETHOD" : [ ],
				"METHODMODIFIERTYPE" : [ ],
				"METHODBODYLINETYPE" : [ ],
				"NUMBEROFMETHODVARIABLES" : 0,
				"NUMBEROFOUTGOINGMETHODS" : 0,
				"METHODRETURNTYPE" : "Map<String,T>",
				"METHODOVERRIDE" : [ ],
				"OUTGOINGMETHOD" : [ ],
				"NUMBEROFMETHODLINES" : 0,
				"METHODPARAMETER" : [ {
					"PARAMETERNAME" : "Class<T>",
					"PARAMETERTYPE" : "@Nullable"
				} ]
			}, {
				"METHODNAME" : "getBeansOfType",
				"NUMBEROFINCOMINGMETHODS" : 0,
				"INCOMINGMETHOD" : [ ],
				"METHODMODIFIERTYPE" : [ ],
				"METHODBODYLINETYPE" : [ ],
				"NUMBEROFMETHODVARIABLES" : 0,
				"NUMBEROFOUTGOINGMETHODS" : 0,
				"METHODRETURNTYPE" : "Map<String,T>",
				"METHODOVERRIDE" : [ ],
				"OUTGOINGMETHOD" : [ ],
				"NUMBEROFMETHODLINES" : 0,
				"METHODPARAMETER" : [ {
					"PARAMETERNAME" : "Class<T>",
					"PARAMETERTYPE" : "@Nullable"
				}, {
					"PARAMETERNAME" : "includeNonSingletons",
					"PARAMETERTYPE" : "boolean"
				}, {
					"PARAMETERNAME" : "allowEagerInit",
					"PARAMETERTYPE" : "boolean"
				} ]
			}, {
				"METHODNAME" : "getBeanNamesForAnnotation",
				"NUMBEROFINCOMINGMETHODS" : 0,
				"INCOMINGMETHOD" : [ ],
				"METHODMODIFIERTYPE" : [ ],
				"METHODBODYLINETYPE" : [ ],
				"NUMBEROFMETHODVARIABLES" : 0,
				"NUMBEROFOUTGOINGMETHODS" : 0,
				"METHODRETURNTYPE" : "String[]",
				"METHODOVERRIDE" : [ ],
				"OUTGOINGMETHOD" : [ ],
				"NUMBEROFMETHODLINES" : 0,
				"METHODPARAMETER" : [ {
					"PARAMETERNAME" : "extends",
					"PARAMETERTYPE" : "Class<?"
				} ]
			}, {
				"METHODNAME" : "getBeansWithAnnotation",
				"NUMBEROFINCOMINGMETHODS" : 0,
				"INCOMINGMETHOD" : [ ],
				"METHODMODIFIERTYPE" : [ ],
				"METHODBODYLINETYPE" : [ ],
				"NUMBEROFMETHODVARIABLES" : 0,
				"NUMBEROFOUTGOINGMETHODS" : 0,
				"METHODRETURNTYPE" : "Map<String,Object>",
				"METHODOVERRIDE" : [ ],
				"OUTGOINGMETHOD" : [ ],
				"NUMBEROFMETHODLINES" : 0,
				"METHODPARAMETER" : [ {
					"PARAMETERNAME" : "extends",
					"PARAMETERTYPE" : "Class<?"
				} ]
			}, {
				"METHODNAME" : "findAnnotationOnBean",
				"NUMBEROFINCOMINGMETHODS" : 0,
				"INCOMINGMETHOD" : [ ],
				"METHODMODIFIERTYPE" : [ ],
				"METHODBODYLINETYPE" : [ ],
				"NUMBEROFMETHODVARIABLES" : 0,
				"NUMBEROFOUTGOINGMETHODS" : 0,
				"METHODRETURNTYPE" : "A",
				"METHODOVERRIDE" : [ "@Nullable" ],
				"OUTGOINGMETHOD" : [ ],
				"NUMBEROFMETHODLINES" : 0,
				"METHODPARAMETER" : [ {
					"PARAMETERNAME" : "beanName",
					"PARAMETERTYPE" : "String"
				}, {
					"PARAMETERNAME" : "annotationType",
					"PARAMETERTYPE" : "Class<A>"
				} ]
			}, {
				"METHODNAME" : "findAnnotationOnBean",
				"NUMBEROFINCOMINGMETHODS" : 0,
				"INCOMINGMETHOD" : [ ],
				"METHODMODIFIERTYPE" : [ ],
				"METHODBODYLINETYPE" : [ ],
				"NUMBEROFMETHODVARIABLES" : 0,
				"NUMBEROFOUTGOINGMETHODS" : 0,
				"METHODRETURNTYPE" : "A",
				"METHODOVERRIDE" : [ "@Nullable" ],
				"OUTGOINGMETHOD" : [ ],
				"NUMBEROFMETHODLINES" : 0,
				"METHODPARAMETER" : [ {
					"PARAMETERNAME" : "beanName",
					"PARAMETERTYPE" : "String"
				}, {
					"PARAMETERNAME" : "annotationType",
					"PARAMETERTYPE" : "Class<A>"
				}, {
					"PARAMETERNAME" : "allowFactoryBeanInit",
					"PARAMETERTYPE" : "boolean"
				} ]
			}, {
				"METHODNAME" : "findAllAnnotationsOnBean",
				"NUMBEROFINCOMINGMETHODS" : 0,
				"INCOMINGMETHOD" : [ ],
				"METHODMODIFIERTYPE" : [ ],
				"METHODBODYLINETYPE" : [ ],
				"NUMBEROFMETHODVARIABLES" : 0,
				"NUMBEROFOUTGOINGMETHODS" : 0,
				"METHODRETURNTYPE" : "Set<A>",
				"METHODOVERRIDE" : [ ],
				"OUTGOINGMETHOD" : [ ],
				"NUMBEROFMETHODLINES" : 0,
				"METHODPARAMETER" : [ {
					"PARAMETERNAME" : "beanName",
					"PARAMETERTYPE" : "String"
				}, {
					"PARAMETERNAME" : "annotationType",
					"PARAMETERTYPE" : "Class<A>"
				}, {
					"PARAMETERNAME" : "allowFactoryBeanInit",
					"PARAMETERTYPE" : "boolean"
				} ]
			} ]
		}
	}
}